{
  "enrollId": "01920000-0000-7000-8000-000000000020",
  "nonce": "6b6b6b6b6b6b6b6b6b6b6b6b6b6b6b6b6b6b6b6b6b6b6b6b6b6b6b6b6b6b6b6b",
  "storeSalt": "7171717171717171717171717171717171717171717171717171717171717171",
  "globalSalt": "7272727272727272727272727272727272727272727272727272727272727272",
  "expiresInMs": 120000
}
